{
  "metadata_version": "1.0.0",
  "schema_id": "urn:sv-playbook:role-protocol:shared:1.0.0",
  "canonicalization": {
    "description": "Deterministic canonical byte representation for JSON artifacts, based on RFC 8785 (JSON Canonicalization Scheme), suitable for whole-artifact digest computation.",
    "scope": "whole-artifact",
    "scheme": "RFC 8785",
    "preconditions": {
      "json_conformance": "JSON text MUST conform to I-JSON (RFC 7493): no duplicate object member names; all strings are valid Unicode; numbers MUST be representable within IEEE 754-2008 binary64 range (finite). Values outside that range (e.g., higher-precision integers) MUST be encoded as strings.",
      "rfc8785_unicode": "RFC 8785 does NOT normalize Unicode. It preserves Unicode strings exactly as present in the input JSON. No NFC/NFD/NFKC/NFKD normalization is applied before or during canonicalization.",
      "validation_order": "Schema validation is applied strictly before canonicalization. Validation either accepts the artifact as-is or rejects it entirely. If validation passes, the artifact proceeds to RFC 8785 canonicalization with exactly the set of properties it contains. Validation does NOT filter, remove, add, or mutate any properties. An invalid artifact is rejected at the validation stage and never reaches canonicalization.",
      "numeric_encoding": "I-JSON restricts numbers to finite IEEE 754 binary64. RFC 8785 serializes numbers according to ECMAScript JSON.stringify semantics. No custom exponent notation restrictions beyond I-JSON are imposed.",
      "artifact_encoding": "Every ArtifactRef governed by this contract resolves to a JSON protocol envelope. Non-JSON payloads MUST be represented by a validated JSON manifest whose media adapter defines and verifies the payload digest separately."
    },
    "rules": "Apply RFC 8785 in full, including its primitive serialization, string escaping, property sorting, whitespace, and UTF-8 rules. This summary is not a replacement for the RFC. Every property in the accepted JSON artifact is included in the canonical form.",
    "rationale": "RFC 8785 provides an interoperable canonical form for JSON data. Combined with I-JSON constraints, it ensures digest stability across implementations. Schema validation accepts or rejects an artifact whole; no properties are filtered. An accepted artifact is canonicalized in full by RFC 8785, producing a single canonical byte representation."
  },
  "validator_contract": {
    "schema_version": "https://json-schema.org/draft/2020-12/schema",
    "validator": {
      "library": "ajv",
      "minimum_version": "8.0.0",
      "options": {
        "strict": true,
        "strictRequired": true,
        "strictNumbers": true,
        "strictTypes": true,
        "strictTuples": true,
        "allErrors": true,
        "addUsedSchema": false,
        "validateSchema": true
      }
    },
    "formats": {
      "plugin": "ajv-formats",
      "mode": "full",
      "description": "Full format validation (not \u0027fast\u0027) must be enabled. Required for date-time, uri, and similar format checks that protocol integrity depends on."
    },
    "schema_fixtures": {
      "description": "Fixtures validated by Ajv against the shared JSON Schema. These test schema-level structural constraints only: field types, patterns, required, enum, const, and conditionals. Cross-field invariants and digest verification are tested separately in runtime_fixtures.",
      "positive": [
        {
          "fixture_id": "pos-digest-valid",
          "description": "A valid sha256 digest with correct-length hex value",
          "target": "#/$defs/digest",
          "value": {
            "algorithm": "sha256",
            "value": "a3c8e7f09b12d45e6f78a901b2c34d56e78f90a1b23c45d67e890f1234a5b6c7"
          }
        },
        {
          "fixture_id": "pos-artifact-ref-sourcing-assessment",
          "description": "A valid artifact-ref with digest",
          "target": "#/$defs/artifact-ref",
          "value": {
            "artifact_kind": "sourcing-assessment",
            "artifact_id": "initial-sourcing-v1",
            "version_digest": {
              "algorithm": "sha256",
              "value": "a3c8e7f09b12d45e6f78a901b2c34d56e78f90a1b23c45d67e890f1234a5b6c7"
            }
          }
        },
        {
          "fixture_id": "pos-req-ref-valid",
          "description": "A valid requirement-ref with all required fields",
          "target": "#/$defs/requirement-ref",
          "value": {
            "contract_id": "contract-1",
            "requirement_id": "func-auth",
            "contract_version": "1.0.0"
          }
        },
        {
          "fixture_id": "pos-subject-artifact-valid",
          "description": "A valid subject with artifact kind",
          "target": "#/$defs/subject",
          "value": {
            "subject_kind": "artifact",
            "subject_ref": {
              "artifact_kind": "sourcing-assessment",
              "artifact_id": "sa-1",
              "version_digest": {
                "algorithm": "sha256",
                "value": "a3c8e7f09b12d45e6f78a901b2c34d56e78f90a1b23c45d67e890f1234a5b6c7"
              }
            }
          }
        },
        {
          "fixture_id": "pos-evidence-locator-file-range-valid",
          "description": "A valid evidence-locator of kind file-range",
          "target": "#/$defs/evidence-locator",
          "value": {
            "locator_kind": "file-range",
            "path": "src/main.ts",
            "start_line": 10,
            "end_line": 20
          }
        },
        {
          "fixture_id": "pos-evidence-ref-file-range",
          "description": "Evidence ref with file-range locator",
          "target": "#/$defs/evidence-ref",
          "value": {
            "evidence_type": "file-content",
            "artifact_ref": {
              "artifact_kind": "code-snapshot",
              "artifact_id": "snap-1",
              "version_digest": {
                "algorithm": "sha256",
                "value": "b4d9f80a12c34e56f7890a12b3c45d67e89f01a23c4d567e890f1b2c34d5e6f7"
              }
            },
            "locator": {
              "locator_kind": "file-range",
              "path": "src/main.ts",
              "start_line": 10,
              "end_line": 42
            }
          }
        },
        {
          "fixture_id": "pos-mechanical-fact-ref-valid",
          "description": "A valid mechanical-fact-ref with all required fields",
          "target": "#/$defs/mechanical-fact-ref",
          "value": {
            "fact_id": "fact-001",
            "fact_domain": "store",
            "locator": "/store/key1",
            "observed_at": "2026-07-12T00:00:00Z",
            "source_digest": {
              "algorithm": "sha256",
              "value": "c4d9f80a12c34e56f7890a12b3c45d67e89f01a23c4d567e890f1b2c34d5e6f7"
            }
          }
        },
        {
          "fixture_id": "pos-provenance-agent-judgment",
          "description": "Agent-judgment provenance with required agent_role_id and session_id",
          "target": "#/$defs/provenance",
          "value": {
            "provenance_kind": "agent-judgment",
            "agent_role_id": "advisor",
            "session_id": "sess-abc123",
            "timestamp": "2026-07-12T00:00:00Z",
            "confirmed_by": null
          }
        },
        {
          "fixture_id": "pos-provenance-runtime-mechanical",
          "description": "Runtime-mechanical provenance with null agent/session",
          "target": "#/$defs/provenance",
          "value": {
            "provenance_kind": "runtime-mechanical",
            "agent_role_id": null,
            "session_id": null,
            "timestamp": "2026-07-12T00:00:00Z",
            "confirmed_by": null
          }
        },
        {
          "fixture_id": "pos-risk-low-valid",
          "description": "Valid low-severity risk with null mitigation (allowed for low)",
          "target": "#/$defs/risk",
          "value": {
            "risk_id": "risk-001",
            "severity": "low",
            "likelihood": "unlikely",
            "description": "Low risk description",
            "mitigation": null
          }
        },
        {
          "fixture_id": "pos-deviation-valid",
          "description": "A valid deviation with all required fields",
          "target": "#/$defs/deviation",
          "value": {
            "deviation_id": "dev-001",
            "subject": {
              "subject_kind": "artifact",
              "subject_ref": {
                "artifact_kind": "code-snapshot",
                "artifact_id": "snap-1",
                "version_digest": {
                  "algorithm": "sha256",
                  "value": "b4d9f80a12c34e56f7890a12b3c45d67e89f01a23c4d567e890f1b2c34d5e6f7"
                }
              }
            },
            "description": "An approved contract behavior is temporarily not met.",
            "reason": "Deviation reason",
            "risk_assessment": {
              "risk_id": "risk-001",
              "severity": "low",
              "likelihood": "possible",
              "description": "Limited temporary impact",
              "mitigation": null
            },
            "affected_requirements": [
              {
                "contract_id": "contract-1",
                "requirement_id": "func-auth",
                "contract_version": "1.0.0"
              }
            ]
          }
        },
        {
          "fixture_id": "pos-escalation-valid",
          "description": "A valid escalation with all required fields",
          "target": "#/$defs/escalation",
          "value": {
            "escalation_id": "esc-001",
            "escalation_class": "capability-gap",
            "cause": "Missing dependency",
            "context": "The artifact store is unavailable",
            "what_is_needed": "Access to store or alternative source",